{
  "kind": "architecture",
  "schemaVersion": "1.0",
  "snapshot": {
    "id": "5d76708faf0112a4bcb3c4b5e5787738a9e5d36dfd5a23552ef6969c506c47f6",
    "model": "DecisionModel",
    "sourceHash": "f8e4c7408fb72e4088f4ac6db3c6764b387a955aea978e8360e0c189615a9505",
    "config": {},
    "mode": "static",
    "toolVersion": "0.1.0",
    "executed": false,
    "parameterCount": null
  },
  "definitions": [
    {
      "id": "def:DecisionModel",
      "symbol": "DecisionModel",
      "sourceRef": "src:DecisionModel:574:658"
    }
  ],
  "instances": [],
  "parameters": [],
  "scopes": [
    {
      "id": "model",
      "label": "DecisionModel",
      "parent": null,
      "owner": null,
      "bindings": [],
      "sourceRef": "src:DecisionModel.forward:609:658"
    }
  ],
  "nodes": [
    {
      "id": "model/input:input_ids",
      "scope": "model",
      "label": "input_ids",
      "role": "input",
      "instance": null,
      "childScope": null,
      "sourceRef": "src:DecisionModel.forward:609:658",
      "explanation": "ex:model/input:input_ids",
      "opaque": true
    },
    {
      "id": "model/input:attention_mask",
      "scope": "model",
      "label": "attention_mask",
      "role": "input",
      "instance": null,
      "childScope": null,
      "sourceRef": "src:DecisionModel.forward:609:658",
      "explanation": "ex:model/input:attention_mask",
      "opaque": true
    },
    {
      "id": "model/input:marker_pos",
      "scope": "model",
      "label": "marker_pos",
      "role": "input",
      "instance": null,
      "childScope": null,
      "sourceRef": "src:DecisionModel.forward:609:658",
      "explanation": "ex:model/input:marker_pos",
      "opaque": true
    },
    {
      "id": "model/input:marker_mask",
      "scope": "model",
      "label": "marker_mask",
      "role": "input",
      "instance": null,
      "childScope": null,
      "sourceRef": "src:DecisionModel.forward:609:658",
      "explanation": "ex:model/input:marker_mask",
      "opaque": true
    },
    {
      "id": "model/input:qtype",
      "scope": "model",
      "label": "qtype",
      "role": "input",
      "instance": null,
      "childScope": null,
      "sourceRef": "src:DecisionModel.forward:609:658",
      "explanation": "ex:model/input:qtype",
      "opaque": true
    },
    {
      "id": "model/input:detach_encoder",
      "scope": "model",
      "label": "detach_encoder",
      "role": "input",
      "instance": null,
      "childScope": null,
      "sourceRef": "src:DecisionModel.forward:609:658",
      "explanation": "ex:model/input:detach_encoder",
      "opaque": true
    },
    {
      "id": "model/input:position_ids",
      "scope": "model",
      "label": "position_ids",
      "role": "input",
      "instance": null,
      "childScope": null,
      "sourceRef": "src:DecisionModel.forward:609:658",
      "explanation": "ex:model/input:position_ids",
      "opaque": true
    },
    {
      "id": "model/input:option_ids",
      "scope": "model",
      "label": "option_ids",
      "role": "input",
      "instance": null,
      "childScope": null,
      "sourceRef": "src:DecisionModel.forward:609:658",
      "explanation": "ex:model/input:option_ids",
      "opaque": true
    },
    {
      "id": "model/dynamic_boundary",
      "scope": "model",
      "label": "if option_ids is None:\n    h = self.encoder(input_ids=input_ids, attention_mask=attention_mask).last_hidden_state\nelse:\n    masks = parallel_option_masks(attention_mask, position_ids, option_ids, getattr(self.encoder.config, 'sliding_window', None))\n    h = self.encoder(input_ids=input_ids, attention_mask=masks, position_ids=position_ids).last_hidden_state",
      "role": "opaque",
      "instance": null,
      "childScope": null,
      "sourceRef": "src:DecisionModel.forward:611:618",
      "explanation": "ex:model/dynamic_boundary",
      "opaque": true
    },
    {
      "id": "model/output:opaque",
      "scope": "model",
      "label": "未知输出边界",
      "role": "output",
      "instance": null,
      "childScope": null,
      "sourceRef": "src:DecisionModel.forward:611:618",
      "explanation": "ex:model/output:opaque",
      "opaque": true
    }
  ],
  "ports": [
    {
      "id": "model/input:input_ids:out",
      "node": "model/input:input_ids",
      "direction": "out",
      "name": "output",
      "tensor": "model/input:input_ids:tensor"
    },
    {
      "id": "model/input:attention_mask:out",
      "node": "model/input:attention_mask",
      "direction": "out",
      "name": "output",
      "tensor": "model/input:attention_mask:tensor"
    },
    {
      "id": "model/input:marker_pos:out",
      "node": "model/input:marker_pos",
      "direction": "out",
      "name": "output",
      "tensor": "model/input:marker_pos:tensor"
    },
    {
      "id": "model/input:marker_mask:out",
      "node": "model/input:marker_mask",
      "direction": "out",
      "name": "output",
      "tensor": "model/input:marker_mask:tensor"
    },
    {
      "id": "model/input:qtype:out",
      "node": "model/input:qtype",
      "direction": "out",
      "name": "output",
      "tensor": "model/input:qtype:tensor"
    },
    {
      "id": "model/input:detach_encoder:out",
      "node": "model/input:detach_encoder",
      "direction": "out",
      "name": "output",
      "tensor": "model/input:detach_encoder:tensor"
    },
    {
      "id": "model/input:position_ids:out",
      "node": "model/input:position_ids",
      "direction": "out",
      "name": "output",
      "tensor": "model/input:position_ids:tensor"
    },
    {
      "id": "model/input:option_ids:out",
      "node": "model/input:option_ids",
      "direction": "out",
      "name": "output",
      "tensor": "model/input:option_ids:tensor"
    },
    {
      "id": "model/dynamic_boundary:in0",
      "node": "model/dynamic_boundary",
      "direction": "in",
      "name": "input0",
      "tensor": "model/input:input_ids:tensor"
    },
    {
      "id": "model/dynamic_boundary:in1",
      "node": "model/dynamic_boundary",
      "direction": "in",
      "name": "input1",
      "tensor": "model/input:attention_mask:tensor"
    },
    {
      "id": "model/dynamic_boundary:in2",
      "node": "model/dynamic_boundary",
      "direction": "in",
      "name": "input2",
      "tensor": "model/input:marker_pos:tensor"
    },
    {
      "id": "model/dynamic_boundary:in3",
      "node": "model/dynamic_boundary",
      "direction": "in",
      "name": "input3",
      "tensor": "model/input:marker_mask:tensor"
    },
    {
      "id": "model/dynamic_boundary:in4",
      "node": "model/dynamic_boundary",
      "direction": "in",
      "name": "input4",
      "tensor": "model/input:qtype:tensor"
    },
    {
      "id": "model/dynamic_boundary:in5",
      "node": "model/dynamic_boundary",
      "direction": "in",
      "name": "input5",
      "tensor": "model/input:detach_encoder:tensor"
    },
    {
      "id": "model/dynamic_boundary:in6",
      "node": "model/dynamic_boundary",
      "direction": "in",
      "name": "input6",
      "tensor": "model/input:position_ids:tensor"
    },
    {
      "id": "model/dynamic_boundary:in7",
      "node": "model/dynamic_boundary",
      "direction": "in",
      "name": "input7",
      "tensor": "model/input:option_ids:tensor"
    },
    {
      "id": "model/dynamic_boundary:out",
      "node": "model/dynamic_boundary",
      "direction": "out",
      "name": "output",
      "tensor": "model/dynamic_boundary:tensor"
    },
    {
      "id": "model/output:opaque:in0",
      "node": "model/output:opaque",
      "direction": "in",
      "name": "input0",
      "tensor": "model/dynamic_boundary:tensor"
    },
    {
      "id": "model/output:opaque:out",
      "node": "model/output:opaque",
      "direction": "out",
      "name": "output",
      "tensor": "model/output:opaque:tensor"
    }
  ],
  "edges": [
    {
      "id": "model/dynamic_boundary:edge0",
      "scope": "model",
      "source": "model/input:input_ids:out",
      "target": "model/dynamic_boundary:in0",
      "tensor": "model/input:input_ids:tensor",
      "condition": null
    },
    {
      "id": "model/dynamic_boundary:edge1",
      "scope": "model",
      "source": "model/input:attention_mask:out",
      "target": "model/dynamic_boundary:in1",
      "tensor": "model/input:attention_mask:tensor",
      "condition": null
    },
    {
      "id": "model/dynamic_boundary:edge2",
      "scope": "model",
      "source": "model/input:marker_pos:out",
      "target": "model/dynamic_boundary:in2",
      "tensor": "model/input:marker_pos:tensor",
      "condition": null
    },
    {
      "id": "model/dynamic_boundary:edge3",
      "scope": "model",
      "source": "model/input:marker_mask:out",
      "target": "model/dynamic_boundary:in3",
      "tensor": "model/input:marker_mask:tensor",
      "condition": null
    },
    {
      "id": "model/dynamic_boundary:edge4",
      "scope": "model",
      "source": "model/input:qtype:out",
      "target": "model/dynamic_boundary:in4",
      "tensor": "model/input:qtype:tensor",
      "condition": null
    },
    {
      "id": "model/dynamic_boundary:edge5",
      "scope": "model",
      "source": "model/input:detach_encoder:out",
      "target": "model/dynamic_boundary:in5",
      "tensor": "model/input:detach_encoder:tensor",
      "condition": null
    },
    {
      "id": "model/dynamic_boundary:edge6",
      "scope": "model",
      "source": "model/input:position_ids:out",
      "target": "model/dynamic_boundary:in6",
      "tensor": "model/input:position_ids:tensor",
      "condition": null
    },
    {
      "id": "model/dynamic_boundary:edge7",
      "scope": "model",
      "source": "model/input:option_ids:out",
      "target": "model/dynamic_boundary:in7",
      "tensor": "model/input:option_ids:tensor",
      "condition": null
    },
    {
      "id": "model/output:opaque:edge0",
      "scope": "model",
      "source": "model/dynamic_boundary:out",